url,product_name,reviewer_name,review_title,review_text,review_rating,verified_purchase,review_date,helpful_count,uniq_id,scraped_at,cleaned_text,review_month,label
https://www.amazon.co.uk/dp/B07RM8C772,"New Balance Women's 996v4 Hard Court Tennis Shoe, Guava/Black, 3 UK",Shoppin Poppins,This is NOT  a Wide Width despite the claim,"I sometimes take a 6 medium width, sometimes a 6 wide, depending on the shoe.  I've had New Balance before and no issues.  However this court shoe in a size 6 was ridiculously narrow, I couldn't even get my foot into the shoe with the laces wide open.  Sending back.",3.0,True,2020-12-08,,2cde9f36-2d2f-527d-a012-f71909c6878c,24/12/2021 02:28:42,sometimes take 6 medium width sometimes 6 wide depending shoe ive new balance issue however court shoe size 6 ridiculously narrow couldnt even get foot shoe lace wide open sending back,2020-12,NEGATIVE
https://www.amazon.co.uk/dp/B01N0E9JUY,adidas Originals Men's Tubular Radial Fashion Sneaker grey Size: 8.5 UK,Amazon Customer,They’re HUGE!,"There looks nice but on my eyes kinda of fake, and big, I MEAN HUGE! I bought it for my husband and he has 6 pairs of Adidas all of them 8.5 and fits perfect! Those are wide and kinda of big, and they even looks huge.",3.0,True,2018-10-04,,df318350-2bfc-567e-b78c-3222fe5aef14,24/12/2021 02:28:42,look nice eye kinda fake big mean huge bought husband 6 pair adidas 85 fit perfect wide kinda big even look huge,2018-10,POSITIVE
https://www.amazon.co.uk/dp/B0007T5JFK,"Cole Haan Men's Tucker Venetian Slip-On Loafer, Black, 15",barb,Narrow shoe,Much to narrow. Opening too small. Looks are everything.,3.0,True,2021-05-20,,74f87faf-605a-522a-80fa-84c0cd557ce4,24/12/2021 02:28:42,much narrow opening small look everything,2021-05,NEGATIVE
https://www.amazon.co.uk/dp/B01D3JEJW4,"APEX LEGENDS Women's Breeze Athletic Knit Running Shoe Sneaker, Grey, 7.5 UK",ACNorthShore,So disappointed they don’t fit!,"So disappointed! I have the Apex natural wool sneaker. I love them, they are currently one of the only pairs of footwear I can wear that is comfortable. I got these because they look like the same shape and style, only different material. Not true! These are much smaller, the toebox is much less roomy. I cannot wear them at all and will have to return them. I was really hoping these were going to be the athletic shoes I have been trying to find for months. Back to the drawing board!Pros- Not bad looking at all. Seems supportive, moderate arch support. Choice of either the elastic waist or regular shoe laces, both are included. That he’ll did not seem too wide, which is a plus.not bad looking at all. Seems supportive, moderate arch support. Choice of either the elastic lace or regular shoelaces, both are included. The heel did not seem too wide, which is a plus.Cons- they seem to run a little small to me. Maybe about half size smaller than I expected. The toebox is shallow. My toe hit the top of the shoe without even moving.",3.0,True,2020-06-20,,0aa98a94-e490-5ca2-be9e-92ca3fa6df69,24/12/2021 02:28:43,disappointed apex natural wool sneaker love currently one pair footwear wear comfortable got look like shape style different material true much smaller toebox much le roomy wear return really hoping going athletic shoe trying find month back drawing boardpros bad looking seems supportive moderate arch support choice either elastic waist regular shoe lace included ’ seem wide plusnot bad looking seems supportive moderate arch support choice either elastic lace regular shoelace included heel seem wide pluscons seem run little small maybe half size smaller expected toebox shallow toe hit top shoe without even moving,2020-06,NEGATIVE
https://www.amazon.co.uk/dp/B076D1RLZM,"JARLIF Women's Lightweight Athletic Running Shoes Breathable Sport Air Fitness Gym Jogging Sneakers, Color Black, Size 7",YO.,These are pretty sturdy and light,"These are pretty sturdy and light.  They are comfortable, soft, and supportive.  I wish the shoe came up a little higher on the foot (more support for ankles) - during some exercises the foot moves in the shoe a bit and doesn't feel as secure.  No rubbing of the heel.  Holds up to vigorous exercise.Update: the tongue of the shoe is very narrow so it bunches up and can get annoying / slightly rub.",3.0,True,2018-07-19,9.0,a4980ee6-21ff-518a-8159-151f7cd214f8,24/12/2021 02:28:44,pretty sturdy light comfortable soft supportive wish shoe came little higher foot support ankle exercise foot move shoe bit doesnt feel secure rubbing heel hold vigorous exerciseupdate tongue shoe narrow bunch get annoying slightly rub,2018-07,NEGATIVE
https://www.amazon.co.uk/dp/B01N0B4D1C,"Saucony Baby Girls Ride Running Shoe, Pink, 5.5 Medium US Toddler",Lydia,Difficult for very young ones...tight across top of the foot.,"The way the shoe is made it is quite tight across the top of the foot where the criss-cross elastics are....my 3.5 year old could not get it on himself. Since he needs to be able to dress himself at pre-school, I had to return these. They did however look very nice, were lightweight and Saucony is a great brand.",3.0,True,2017-04-09,,0377fc2b-ea5b-59e1-9b7b-59a33871191f,24/12/2021 02:28:44,way shoe made quite tight across top foot crisscross elastic aremy 35 year old could get since need able dress preschool return however look nice lightweight saucony great brand,2017-04,NEGATIVE
https://www.amazon.co.uk/dp/B000BO9WE0,Propet Women's W3910 Vista Walker Comfort Shoe Black Size: 8 UK,Shopsonceinawhile,size 8EE) on numerous occasions before and I have always been super impressed and the fit was always perfect for my ...,"I have bought this particular brand of shoe (Propet Vista Walker, size 8EE) on numerous occasions before and I have always been super impressed and the fit was always perfect for my extra wide feet.  However, there seemed to be something different about the fit and the way these shoes balance on my feet and I am dissapointed and unable to wear them.  For some reason, they seem to be loose around the sides and stones are constantly getting in somehow (its hard to explain).  Also the left shoe fits a bit better than the right shoe.  The right shoe seems to throw my balance off so I tip to the right and I have developed a callous on my right foot since wearing them.  This has never happened before with previous Propet Vista Walkers.  I find I can not wear this pair at all unfortunately.  I have gone back to wearing my older Vista Walkers, same size, same brand and they are fine so no idea why the new pair is different to all the others I've purchased previously.  Its a mystery.  I wonder if the company have changed something in the manufacturing process or if I just got a pair of duds :(",3.0,True,2017-03-17,,4174e436-dcb5-5a95-9aab-cef4c98c8764,24/12/2021 02:28:45,bought particular brand shoe propet vista walker size 8ee numerous occasion always super impressed fit always perfect extra wide foot however seemed something different fit way shoe balance foot dissapointed unable wear reason seem loose around side stone constantly getting somehow hard explain also left shoe fit bit better right shoe right shoe seems throw balance tip right developed callous right foot since wearing never happened previous propet vista walker find wear pair unfortunately gone back wearing older vista walker size brand fine idea new pair different others ive purchased previously mystery wonder company changed something manufacturing process got pair dud,2017-03,NEGATIVE
https://www.amazon.co.uk/dp/B082Y43HK2,Brooks Womens Range Running Shoe - Oyster Mushroom/Alloy/Fiery Coral - B - 6,Samantha,Comfortable but slippery on concrete,"While I love Brooks shoes and wear them also as work shoes, these were a little disappointing.  I wore these the day after I received them and ended up slipping on asphalt and landing on my knee.. they were also slick in my kitchen as if they had oil on the soles.. They are comfortable but not safe to wear. Since I threw the box away I cannot return so basically a waste of money as far as a shoe for work. (I am a nurse). I would not recommend these for running since I slipped on asphalt just walking.",3.0,True,2021-06-04,2.0,e15e88a5-05d7-577b-bd33-f2b798ed6b94,24/12/2021 02:28:46,love brook shoe wear also work shoe little disappointing wore day received ended slipping asphalt landing knee also slick kitchen oil sol comfortable safe wear since threw box away return basically waste money far shoe work nurse would recommend running since slipped asphalt walking,2021-06,NEGATIVE
https://www.amazon.co.uk/dp/B082Y43HK2,Brooks Womens Range Running Shoe - Oyster Mushroom/Alloy/Fiery Coral - B - 6,Amazon Customer,A little too small,Followed the measurement instructions and ordered half a size up but it was too small. Reordering a full size up (7 instead of 6).The shoe is well constructed.,3.0,True,2020-10-17,2.0,a7af7553-7146-50d5-9e64-1dd3607ba463,24/12/2021 02:28:46,followed measurement instruction ordered half size small reordering full size 7 instead 6the shoe well constructed,2020-10,POSITIVE
https://www.amazon.co.uk/dp/B082Y43HK2,Brooks Womens Range Running Shoe - Oyster Mushroom/Alloy/Fiery Coral - B - 6,Lauren M,Runs Narrow,"I ordered these in a size 7. The length was good but they were very narrow.  I had to really loosen the laces and it still felt really tight width wise, and I don't even have a wide foot. I wound up returning them.",3.0,True,2020-10-22,,695b3434-bae0-5d7f-904f-d320ae8fbc04,24/12/2021 02:28:46,ordered size 7 length good narrow really loosen lace still felt really tight width wise dont even wide foot wound returning,2020-10,NEGATIVE
https://www.amazon.co.uk/dp/B082Y43HK2,Brooks Womens Range Running Shoe - Oyster Mushroom/Alloy/Fiery Coral - B - 6,Kaitlyn,So small,"I am a true 8.5 in all shoes including other models of Brooks but for some reason, I couldn't even get my foot into these so had to send them back. The shoe itself is a nice style though just the sizing is super weird.",3.0,True,2021-02-01,,14f72249-07c0-5afb-a632-16df224eacbc,24/12/2021 02:28:46,true 85 shoe including model brook reason couldnt even get foot send back shoe nice style though sizing super weird,2021-02,POSITIVE
https://www.amazon.co.uk/dp/B082Y43HK2,Brooks Womens Range Running Shoe - Oyster Mushroom/Alloy/Fiery Coral - B - 6,rachel12241,Just ok,Get brooks your feet won’t hurt anymore they said so I got a pair!!! Yeah my feet fury still! I walk an average of 8 miles a day between 2 jobs ! I’m not impressed!,3.0,True,2021-07-07,,29b09a68-0a2b-5001-a356-109b91f021f0,24/12/2021 02:28:46,get brook foot ’ hurt anymore said got pair yeah foot fury still walk average 8 mile day 2 job ’ impressed,2021-07,NEGATIVE
https://www.amazon.co.uk/dp/B078XY7FD1,"Sperry Men's Seamount Winter Chukka Boot, Black/Grey, 13 M US",Camryn,Too small,"These boots are such great quality, seem warm and have a great tread. The kicker- they fit a whole size small. Will be returning and disappointed",3.0,True,2019-04-08,,159349d6-3619-54db-bed5-e6e41a118e97,24/12/2021 02:28:46,boot great quality seem warm great tread kicker fit whole size small returning disappointed,2019-04,NEGATIVE
https://www.amazon.co.uk/dp/B078XY7FD1,"Sperry Men's Seamount Winter Chukka Boot, Black/Grey, 13 M US",Ian McGregor,Comfortable boot,Good boot but top strap just slows down getting on and off.,3.0,True,2019-08-21,,f69921c5-30e8-52da-9cfb-201579c0c434,24/12/2021 02:28:46,good boot top strap slows getting,2019-08,NEGATIVE
https://www.amazon.co.uk/dp/B078XY7FD1,"Sperry Men's Seamount Winter Chukka Boot, Black/Grey, 13 M US",Rossmon,"Comfortable, but design flaw","Very comfortable and stylish, but have a major issue that there is no strap in the back to help pull them on.  nearly impossible to put on without a shoehorn.",3.0,True,2018-11-20,3.0,f6ac4e9d-a662-508b-9462-d734fbe0a0e3,24/12/2021 02:28:46,comfortable stylish major issue strap back help pull nearly impossible put without shoehorn,2018-11,NEGATIVE
https://www.amazon.co.uk/dp/B07VCTMM58,"Merrell Women's J033324 Hiking Shoe, Aluminum, 7 UK",MM,"Heavy shoe with no arch support, but well-made otherwise","I have worn Merrells for many year so,Cons: I understand that some hiking shoes tend to be heavy but these are too heavy for me-- like weights on my feet. And while I have no arch issues with my feet, I was surprised that my arch felt overly stretched with each step because the soul was so flat.Pros: Nice looking shoe, well-made, comfortable except for the arch issue and weight.Conclusion: I will keep these shoes and add my own supports inside. But they could have been better. I will need to get something lighter, as well.",3.0,True,2021-03-13,,0f318eab-55e3-5e41-a803-82d4ff841041,24/12/2021 02:28:46,worn merrells many year socons understand hiking shoe tend heavy heavy like weight foot arch issue foot surprised arch felt overly stretched step soul flatpros nice looking shoe wellmade comfortable except arch issue weightconclusion keep shoe add support inside could better need get something lighter well,2021-03,NEGATIVE
https://www.amazon.co.uk/dp/B07VCTMM58,"Merrell Women's J033324 Hiking Shoe, Aluminum, 7 UK",TCLEM,Tight,"I normally wear a 7.5 and I feel like this shoe is true to size in length. BUT the tongue of this shoe is attached and feels like there is a tight band across the top of my foot, so much so that it left indentions after only 10 minutes of wearing them just inside my house. I ended up returning those shoes because of this reason. They felt like a comfortable sole and i have had shoes in the past with an attached tongue but these were just to tight across the top. Otherwise good shoe.",3.0,True,2021-06-11,,79ee560f-578a-5745-a02a-7a5ec57f10dc,24/12/2021 02:28:46,normally wear 75 feel like shoe true size length tongue shoe attached feel like tight band across top foot much left indention 10 minute wearing inside house ended returning shoe reason felt like comfortable sole shoe past attached tongue tight across top otherwise good shoe,2021-06,POSITIVE
https://www.amazon.co.uk/dp/B083TFKYQY,"Dearfoams Kids' Clog Slipper, Shark",Vicky,Very cute but does not stay on,"My granddaughter loved this slipper, but was disappointed because it won't stay on. The back is too low and it keeps coming off of her feet. She won't wear them.",3.0,True,2020-05-27,11.0,cd748c3a-ce3f-545c-8d46-87dd90f0f638,24/12/2021 02:28:47,granddaughter loved slipper disappointed wont stay back low keep coming foot wont wear,2020-05,NEGATIVE
https://www.amazon.co.uk/dp/B083TFKYQY,"Dearfoams Kids' Clog Slipper, Shark",Carrie Nordberg,"Comfy slippers, poor quality construction","These are great slippers EXCEPT for the poor sewing of the horns on the top.  One horn was falling off when they arrived, and within 2 days, 3 more horns were falling off.  I sewed them all back on tightly, but this may be a problem for someone with no needle and thread.",3.0,True,2020-06-17,7.0,cf3ce34b-d7c5-5885-844a-32b8bd80fd4c,24/12/2021 02:28:47,great slipper except poor sewing horn top one horn falling arrived within 2 day 3 horn falling sewed back tightly may problem someone needle thread,2020-06,NEGATIVE
https://www.amazon.co.uk/dp/B0855LSBDL,Speed TR,Amazon Customer,Holy Grail Shoe.,"This is the best all around fitness shoe I’ve owned. Speed TR’s can do it all, I’ve done everything from squats to short runs to playing basketball in these and they handle it all more than capably. They don’t look too bad when worn casually either. Buy them.*Edit* Still love the fit and look of these shoes, but the outsole wears away very quickly. Wore them for about 3 weeks and chunks of the grip started tearing away.",3.0,True,2021-02-26,10.0,1980b3dd-5007-56c9-bbc1-aff6b48aecdf,24/12/2021 02:28:47,best around fitness shoe ’ owned speed tr ’ ’ done everything squat short run playing basketball handle capably ’ look bad worn casually either buy themedit still love fit look shoe outsole wear away quickly wore 3 week chunk grip started tearing away,2021-02,NEGATIVE
https://www.amazon.co.uk/dp/B082YVFT9W,"Merrell Men's Alpine Sneaker, Black, 7.5 UK",Amazon Customer,DO NOT wear these on the trail!,"The side to side tread pattern will break your ankle on mud, ice, or snow. There is nothing to stop lateral sliding on slick surfaces. Also the front lip game unglued on the first hike. They look good though, should be fine for social distancing or Subaru driving.",3.0,True,2021-04-02,10.0,6db3cbb0-8df9-5cb1-a50f-0e4d5a13d6c0,24/12/2021 02:28:48,side side tread pattern break ankle mud ice snow nothing stop lateral sliding slick surface also front lip game unglued first hike look good though fine social distancing subaru driving,2021-04,POSITIVE
https://www.amazon.co.uk/dp/B06XXPGBNP,"Bearpaw Women's Irene Trainers, Pink (Fuschia Knit Mix 645), 3 UK (36 EU)",Taryn K Kellom,"Cute, but back cuts into heel :(","These shoes are so cute and comfy, but the back comes up really high and rubs/cuts into the back of my heel.  I had to return them.",3.0,True,2018-11-07,,6a50e64e-9a5e-5503-814e-e40ebe20a3b6,24/12/2021 02:28:48,shoe cute comfy back come really high rubscuts back heel return,2018-11,NEGATIVE
https://www.amazon.co.uk/dp/B07ZBZXQCC,"CLEECLI Women's Ballroom Dance Shoes Latin Salsa Dancing Shoes Cross Strap 2.5inch 3inch Heel ZB04, Tan-2.5 Inch Heel, 8 UK",L. G.,Sizing chart is off--these are way too small,"I got these shoes for my daughter in middle school who is taking a social dance class. I didn't want to spend a lot of money on them because it's only a one-semester class, and she is not going to need them after that. These seemed like a good deal, so I carefully measured her feet and used the sizing chart to order a size 6.5--even though she wears between a size 8-9  street shoe. Her feet are a little on the wide side, but not wide enough that she can't wear 'regular' (non-wide width or 'B' width) shoes. When these shoes came, they were size 7 (not the 6.5 I ordered), but it didn't even matter because the shoes were several sizes too small. She could cram her feet into them after several minutes of struggling, but it was easy to see that the straps dug into her skin and her toes were off the edge. I sent them back. I wanted to order a size 8, but the style she had to have for her class (brown color and 2.5-inch heel) was not available (sold out/backordered). I didn't have time to order something else from Amazon (even with 2-day shipping) and wait for it to be delivered, so I ended up going to a local dance store and spending A LOT more money on something that she could try on that was approved for her class. She also needed heel guards, which were easy to find at the local store, but almost impossible to try to determine the right size and shape for this dance shoe on Amazon. Anyone who sells dance shoes should also sell heel guards to fit them. I would have loved to have gotten these in a size 8--I think they would have worked and been a good shoe for what we needed at a good price.",3.0,True,2021-01-29,,cbf36210-0c06-53d3-86a2-3d677186703a,24/12/2021 02:28:48,got shoe daughter middle school taking social dance class didnt want spend lot money onesemester class going need seemed like good deal carefully measured foot used sizing chart order size 65even though wear size 89 street shoe foot little wide side wide enough cant wear regular nonwide width b width shoe shoe came size 7 65 ordered didnt even matter shoe several size small could cram foot several minute struggling easy see strap dug skin toe edge sent back wanted order size 8 style class brown color 25inch heel available sold outbackordered didnt time order something else amazon even 2day shipping wait delivered ended going local dance store spending lot money something could try approved class also needed heel guard easy find local store almost impossible try determine right size shape dance shoe amazon anyone sell dance shoe also sell heel guard fit would loved gotten size 8i think would worked good shoe needed good price,2021-01,NEGATIVE
https://www.amazon.co.uk/dp/B071F7VL2P,"adidas Originals Women's Tubular Shadow W Running Shoe, Core Black/Black/Legacy White, 9.5",Nickay ,Fit is great.,"The fit is really great. I am a size 8 and I bought a 7.5. It never squeezes me except for the annoying band under the lace and it affects mostly my left ankle constantly. No matter how I try to fix it, it always digs into my skin. The picture is dead on, and what you see is what you get. I wish the laces were not that thick because they do not keep tied for long. For comfort i would say a 7.5 out of 10.",3.0,True,2018-11-10,,103c62af-a085-55de-a0ca-158d049bdaf4,24/12/2021 02:28:50,fit really great size 8 bought 75 never squeeze except annoying band lace affect mostly left ankle constantly matter try fix always dig skin picture dead see get wish lace thick keep tied long comfort would say 75 10,2018-11,POSITIVE
https://www.amazon.co.uk/dp/B005BKPNXI,Merrell Ontario Mid,Digipete,Merrell might be slipping.. QualityControl probs?,"Seams are cheaply glued, but I'm going to give these a shot since Merrell has never really let me down. I can hardly believe they'd put their name on something that really doesn't seem sturdy or waterproof. To be safe I went over the (already clearly separating) seams with Aquaseal, will update review after this Canadian winter.",3.0,True,2019-09-27,3.0,ffee90d4-5c1e-5944-bb94-0858bb0bad04,24/12/2021 02:28:50,seam cheaply glued im going give shot since merrell never really let hardly believe theyd put name something really doesnt seem sturdy waterproof safe went already clearly separating seam aquaseal update review canadian winter,2019-09,NEGATIVE
https://www.amazon.co.uk/dp/B07T4M4NHV,"Reebok Women's Princess Sneaker, White/White/Collegiate Royal, 6 UK",Girly Girl,The quality has gone wayyyy down!,These are not the Reebok princess shoe you fondly remember.  They’re not leather.  They are stiff and very narrow and don’t let your feet breathe at all.  A big disappointment!,3.0,True,2020-03-08,3.0,b579e885-e648-533f-9127-e30cb6c9275c,24/12/2021 02:28:51,reebok princess shoe fondly remember ’ leather stiff narrow ’ let foot breathe big disappointment,2020-03,NEGATIVE
https://www.amazon.co.uk/dp/B07T4M4NHV,"Reebok Women's Princess Sneaker, White/White/Collegiate Royal, 6 UK",lizbeadbox,"Aside from replacing the insole, theses shoes fit as well as previous Reebok’s have.","I purchased this pair of shoes to replace this exact brand & style shoe.  I have needed to replace the insole with a thinker one that has a better arch & a bit more cushion.  Otherwise, these shoes fit as my previous Reebok’s did. I wear these as Winter shoes.  Our winters are fairly mild here in Texas, so this type of shoe works well.  The black color works well with most jeans/slacks.",3.0,True,2020-08-01,,d9990dfb-7c5e-54ee-a7d6-3d4510f99796,24/12/2021 02:28:51,purchased pair shoe replace exact brand style shoe needed replace insole thinker one better arch bit cushion otherwise shoe fit previous reebok ’ wear winter shoe winter fairly mild texas type shoe work well black color work well jeansslacks,2020-08,POSITIVE
https://www.amazon.co.uk/dp/B07T4M4NHV,"Reebok Women's Princess Sneaker, White/White/Collegiate Royal, 6 UK",judy,shoe fits snug,"these shoes have changed, i've been buying these for years and they always fit great.  this pair is very snug.  i've only tried them on i havent worn them anywhere so maybe they will stretch out a little bit.  i'm hoping so.  but just trying them on it was hurting my toes so when i do where them the first time it will probably only be around the house to see if i can stretch them a little.  it says these are wide but they dont feel like it.",3.0,True,2020-07-11,,d5f37368-5618-56e9-a2d6-634c52aae11d,24/12/2021 02:28:51,shoe changed ive buying year always fit great pair snug ive tried havent worn anywhere maybe stretch little bit im hoping trying hurting toe first time probably around house see stretch little say wide dont feel like,2020-07,NEGATIVE
https://www.amazon.co.uk/dp/B07T52KZ45,"Clarks Women's Pawley Springs Sneaker, Black Leather, 3.5 UK",Briana Lavoie,Not supportive like classic Clarks shoes,"These are cute, and I like the style. I was disappointed that they didn't have the arch support that I would have expected from the Clarks brand. Not sure if I will be keeping them. They are comfortable otherwise.",3.0,True,2020-05-15,13.0,2c42dc90-06d0-53e4-ab01-21e0ef10da44,24/12/2021 02:28:51,cute like style disappointed didnt arch support would expected clark brand sure keeping comfortable otherwise,2020-05,POSITIVE
https://www.amazon.co.uk/dp/B07T52KZ45,"Clarks Women's Pawley Springs Sneaker, Black Leather, 3.5 UK",Stephanie W.,Fitting,Pinches at the toes,3.0,True,2020-07-11,9.0,8b4e3de3-c9ef-5f1d-82b7-e178e69e978e,24/12/2021 02:28:51,pinch toe,2020-07,NEGATIVE
https://www.amazon.co.uk/dp/B07KXZBJ3N,Black Diamond Mens Zone Climbing Shoes,Bryant Tovrea,Order a size larger than expected!,"They look great and feel strurdy but, I haven't been able to try them. I normally wear 9.5 tennis shoe. I ordered a size 10 and they are still too small. I will rerate when I get an exchange",3.0,True,2019-08-02,,ca94bd01-80f0-5049-8311-028e06433e08,24/12/2021 02:28:52,look great feel strurdy havent able try normally wear 95 tennis shoe ordered size 10 still small rerate get exchange,2019-08,NEGATIVE
https://www.amazon.co.uk/dp/B079DF1BKF,"Merrell Women's Riveter Wool Sneaker, Black, 9.5 M US",Kimberly weston,They are very warm on your feet even without socks.,"I used them for work, they are pretty comfy but not for 10 hour days.",3.0,True,2020-09-21,,106d34ba-019e-5eb4-a92c-be052aedbb2c,24/12/2021 02:28:53,used work pretty comfy 10 hour day,2020-09,POSITIVE
